,asin,helpful,overall,reviewText,reviewTime,reviewerID,reviewerName,summary,unixReviewTime
423,1400532655,"[5, 5]",5.0,"I got mine from B&N; and I'm very happy with it! My color ebooks look so great on it. The only problem I have is with playing youtube videos. I'm using the link B&N; put on my bookmarks.Other than that though, its awesome. It works really well & haven't had any trouble with any ebooks....however some image scanned pdf books need to be flicked up/down instead of sideways like regular books.UPDATE:After playing with it a little longer, I got things going better. My youtube videos all work fine and I love it even more now.I have actually purchased a few different ereaders before this since I was trying to find one I liked (such as Sony Touch, kindle and a few others which are all newest models) and my NookColor is my absolute favorite!A few problems that I hope may be fixed with future updates is when I visit certain pages (ex: google.com) & tap a text box to type something in, my keyboard will dissappear & I have to tap text box a few times to get it to reappear.The other thing is my sound seems very low when turned up all the way.In any case, I still LOVE it. The color is AMAZING & I can use this for hours! No eye strain trouble here & it is able to read EVERY ebook I load onto it. I haven't had to buy any B&N; books yet because I already owned so many","11 30, 2010",A19CV4KEXXAA1N,LiLEri,Love My NookColor!!!,1291075200.0
424,1400532655,"[4, 4]",5.0,"REVIEW....Part 2:Loved my Nook Color before the new software updates and app additions...but now!!  WOW!! I own a Motorola Xoom Tablet and have only had it for about a month.  If these updates had come a month earlier I may never have purchased the Xoom, but with that said, and now that I have both, their are differences that I'm glad to own both.Nook Color for the value:emailgamesadobe flash (you tube and much more)musicreading (books and magazines with brilliant color) prefer the Nook for reading bookssurfing the internetsize (easy to hold)and for women it fits in my handbagVersus...Motorola Xoom:emailgamesadobe flash (you tube and much more)sharper picture when viewing movies/videosmusicreading (from kindle and nook downloads to the Xoom with their apps)surfing the internetsize (being larger for a better viewing experience) it won't fit in my handbag (but that's mine)quality is amazingmuch more....There are many many things similar to the Nook versus Xoom or Ipad but the value of the Nook Color over the others isthe best and for your average user who just wants to surf the net, view videos, read your email, listen to music andplay (at the moment limited games) and to read books (size for holding to read is perfect) the Nook Color is the BEST valueand it won't disappoint.1st review:Received my NookColor for Christmas and waited until now to write my review.  I wanted to make sure what I write will help others.  Take this device for what it is....a e-reader and not a tablet.  I love it for reading ebooks and emagazines.  A perfect size for books and just a little too small for magazines but if you have patience you can make any page larger just by pinching your fingers open.The color of photos are amazing and beautiful.  I can view just about any website, but not videos from flash.  Again this is not a tablet. But I can view many Youtube videos.  I have downloaded my own photos and they look great.I cannot open my emails from my carrier (comcast), not sure why. The website...but not the individual emails from my contacts.The touchscreen is pretty sensitive and sometimes I end up having to do things twice.I gave my review four stars only...because of my email restrictions and the sensitivity of the touchscreen.Overall I do love the size and the many things you can do with the NookColor.FYI...I typed this review on my NookColor...","02 28, 2011",A3VI7503NDDODN,"Lisa M. Scolaro ""Sympathetic Mom""",GENIUS!!....for only $249.00,1298851200.0
425,1400532655,"[1, 3]",2.0,"You can get this for about $40 less at B&N directly (plus tax), or at that same lower price, without tax, at their site.","06 26, 2011",A22RY8N8CNDF3A,"Loyd E. Eskildson ""Pragmatist""",Guess What -,1309046400.0
426,1400532655,"[0, 0]",4.0,I bought this item for my wife for Christmas. I didn't know what to expect since this wasn't what she actually wanted. But I knew what she needed as she is a book worm and has magazines n books strayed everywhere. She also has no intent on getting rid of them no time soon. Needless to say it had to grow on her (she wasn't too thrilled at first). Now that thing is everywhere and I don't haveto live with magazines everywhere taking up space.  Afterward I bought an hd+. We've been more than happy with our decision.,"04 4, 2013",A1D3X5TOQV6FQ7,marofromcuse,High stakes bet.,1365033600.0
427,1400532655,"[3, 3]",5.0,"The ColorNook was a great device when they first put it out at the end of 2010. However, it is incredible with the new upgraded software that came out at the end of April 2011. You can do email, there are apps, videos are super!!! And there is flash. I also like the fact that I can adjust the brightness of the screen to prevent eyestrain.You can have multiple email addresses on the email account, which is great for me as I have 3 separate email addresses. In an effort to protect my computer from emailed viruses, I am opening my email on my Nook. That way if a virus sneaks in, it takes out a less expensive device than my computer.I also like the idea of being able to subscribe to magazines that are photo intensive and I can actually see the pictures in color.That said, I still like my Kindle ereaders very much for reading books.","05 9, 2011",A2FPGZXBPCLMMM,"Marsha ""oufootballfan""",Incredible with the software upgrade,1304899200.0
428,1400532655,"[10, 10]",5.0,"The Nook Color is OK as an e-book reader and the apps Barnes and Noble offer are OK, but I installed a 16gb SD card with the Android OS and this thing is smokin.  I can watch Netflix, listen to local radio stations and you can get any of the apps in the world, not the just few Barnes and Noble offer.","06 20, 2011",A146H9ZF0SNKLW,M. D. Young,It has to be rooted,1308528000.0
429,1400532655,"[3, 10]",2.0,"I bought the Nook color after using the original Nook wifi to read a few books.  I'm sure like many people I was drawn to the ""color"" of the screen.  It is crystal clear, it's great for books with drawings or art in them.  Really brings it to life.  This is about all I've really liked.What I don't like is its heavy.  Compared to the original Nook and the Kindle it's a heavy monster.  The screen glares with everything.  I hate seeing myself in the screen when I'm trying to read.  The touchablilty of the screen is 100 times better than the b/w Nook.  It doesn't turn when you turn the Nook itself, even though you have the screen adjustment feature turned on.  Did I mention it was heavy?  Also I took it outside and yes I adjusted the brightness all the way up.  However, I could not read the screen with my sunglasses on even at its brightest setting.  It's like my Iphone, can't see the screen in sunlight.  This is the part that frustrated me the most.  Also the lighted background of the reading screen seemed to make my eyes excessively tired after long periods of reading.  The battery life is pretty short too.  Overall, I wouldn't recommend this ereader.  Get the Kindle, you'll be much happier and it's cheaper.  Also Kindle books don't charge tax to buy them like Nookbooks.","05 29, 2011",AOY9SZTMNQWAW,Mercedes,Get a Kindle Instead,1306627200.0
430,1400532655,"[3, 3]",5.0,"I bought a refurbished Nook Color a few months ago as well as a dual-boot android Micro-SD card (from eBay).  This is by far the best value tablet I've found anywhere!  NC is well made, arrived in like-new condition, reliable, responsive and by booting to full Android (with the dual-boot micro-SD) it is a real tablet with full access to the Android market. Only cons are lack of microphone or camera, but for a total cost of &lt;$180 it's awesome!  Good battery life, beautiful screen, responsive and a really excellent reader (especially in low light - but the screen can be made very bright for daytime use).  I also have a Kindle keyboard which I love for daytime reading but the NC works in the evenings in a darkened room and does all the other things a tablet can do.  Just NC on a holiday trip and left my laptop behind!  NC was perfect for email, RSS, games and reading, including pdf books and Netflix movies.  If you have an Android phone, using this is the same with a much better screen.  It's a really good tablet as is, but with the dual-boot MSD card it is an awesome deal!","01 2, 2012",A23K0A6DL5HQQ3,MG,Excellent value tablet (with dual-boot card),1325462400.0
431,1400532655,"[5, 5]",4.0,"I went into the tablet market for two reasons: (1) I read mostly inside in the evenings and was tired of needing a book light for the e-ink reader and (2) I wanted to consolidate my travel electronics from phone + ereader + notebook.  The prices of straight tablets were outrageous to me when my primary purpose was to eliminate taking the laptop along to be able to review email and do moderate web browsing on a decent sized screen (the phone was way too small).  After reading several reviews and recommendations, I settled on a used Nook Color for both price and performance.  I have not been disappointed.  I have rooted my device for a full blown Android experience and a far superior web browser but rooting is not needed for the basics. I'm just someone who likes to tinker.Everyone needs to understand, this is an e-reader first and a tablet second even when rooted.  At $200, you cannot expect what you would get with a $500-$600 device.  But, it does what it is intended to do quite well.  At 7 inches the screen is comparable size to most e-readers and that was important to me for portability.  I simply swapped the e-ink reader for the Nook Color and it still fit perfectly in my purse.  The Nook Color is also really good for reviewing emails and smooth web browsing.  My rooted device has an overclocked processor so I have no problems with speed.  It's perfect for quickly reaching out to the web to check the latest news, weather, etc. and then get right back to reading my books.  I haven't had many problems running other Android tablet applications and have found that the problems I have had seem to be common problems with the applications themselves.If you want a premium e-reader, this is a super nice product at a great price.  If you're looking for a budget tablet without all of the bells and whistles (camera, gps, microphone) but that will handle the basics of email, web browsing, Netflix, Hulu Plus, and other consumption tasks, this is more than adequate and enjoys much more favorable reviews than similarly priced tablets (with the exceptions of the Kindle Fire and its own successor the Nook Tablet).  The bottom line with this little marvel is to keep your expectations in line with what you're paying for and what you're not paying for. If you expect a $200 version of the standard bearer (i.e IPad), then you'll be very happy.  If, however, you're expecting a $200 equivalent, then look elsewhere.","12 22, 2011",A13OA6RAGTF183,"M. Prince ""No second chances""",Great as a backlit ereader and more than adequate as a tablet,1324512000.0
432,1400532655,"[2, 10]",1.0,"I have a Amazon Kindle E-reader and few hundred books and was wondering ifthe ""Nook"" works on the same book format (mobi) as the kindle.  I Emailed a friend last night and he wrote back this morning  saying his Nook was dead in the water (it can happen with any of them)  What was funny was he said he wrote a review on the Nook  and said that he purchased a Color Nook and have enjoyed it for many years. Then one day it stopped working so he called customer service and was transferred to some foreign country where the woman could not speak English well,  so he asked to speak to another. Next a man came on who spoke worse that the woman so he asked if there was another person. When talking to the next person he was rude so he  asked customer service if he  could sent it in for repair.  The Nook Rep.  had gotten mad and said sure sent it back to North Korea and hung up the phone.  He said he  sent a number of Emails and they didn't  respond or when they did they say read the manual.  So John the Nook is great until you need service but to answer your question I can't open mine  to see the format so you may have to go by a Barnes and Nobel and ask them. You may need to hurry as Barnes and Nobel books stores may be closing the doors soon. Most everyone is switiching over to the E-readers.","04 30, 2012",A1OPS8Q346ZPRV,M. P. Wills,Send it back to North Korea,1335744000.0
433,1400532655,"[0, 0]",4.0,"I was looking for a e-reader for our 13 year old's birthday this past October.  After researching the popular e-readers i.e. the Kindle Fire, I went with the Nook Color for one simple reason; the ability to Root it and turn it into an Android tablet, for a lot less! (It also takes a macroSD card). While you can find the Kindle rooted too, I found the Nook Color rooted was more readily available and more affordable. Since I was purchasing for a teen I  did not want to get a new or more expensive model.We purchased one that was already rooted to cyanogenmod 7.  You can also purchase an macro SD card here or on Ebay that is rooted for you if you already own a Nook Color.We connected it to our home wi-fi and Viola, she can do everything i.e. text free, download games and unlimited apps from the Market. The rooted Nook Color can do everything a tablet can do except for make or receive phone/video calls.Note, all rooted Nook Colors are not the same version.  We purchased one for our son for this Christmas and I did not notice it was not cyanogenmod 7.  This is relevant as it did not possess full access to all of the apps on the Google Play (or Android market) as our daughter's does.  You can update the Root software and I did that but I did not notice a change in its ability to download the other apps. But honestly, I was tired at that point and gave it to our son on Christmas as it was good otherwise and I doubt he would notice. LolThis model is perfect for my teens, but I am thinking about the Kindle Fire HD for myself because it has a good camera and I love photography.P.S. I also purchased a silicone case in yellow and it brightens up the dark tablet a lot.  (I purchased both Nook Color e-readers used for $66 and $87 each on Ebay.)","12 30, 2012",A3V1YKHR8W22X2,"M. Sims ""m.sims""",Turn your Nook Color into a Tablet!,1356825600.0
434,1400532655,"[0, 0]",5.0,this was a life saver for me after my wifes operation it kept her occupied we still have it and she loves great investment,"12 13, 2012",A712TJ5820FAY,Neil Eisenwasser,nook,1355356800.0
435,1400532655,"[0, 0]",5.0,"I don't know why people make fun of these I just happen to love mine. It's very versatile, easy to use, you can add more space, and it's not too big. And it seems like they are getting huge now. I get hours of enjoyment out of it from reading, doing puzzles, playing games and listening to music. And mine is used!","01 18, 2014",A2MBKEPPUSAVUS,Niecy,Old But Good,1390003200.0
436,1400532655,"[3, 3]",5.0,"I'm sure a lot of other potential E-Book wanna-be owners are wondering which one to buy. I was ready to order a Kindle, sight unseen, because anything that sells that well with so many rave reviews has to be good. Then I went to a local ""big Box"" store that carries the Kindle and the NookColor and seeing the fantastic color screen of the Nook sold me on that one.  Nothing against the Kindle but the NookColor brings childrens books (I have a 4yo granddaughter) and magazines to life.The Nook has a few quirks but none are deal breakers.  If you can, take one for a test drive.","04 6, 2011",A341HCMGNZCBIT,Ordinary guy,The color screen sold me,1302048000.0
437,1400532655,"[1, 1]",3.0,"I bought the Nook Color for its intended role as an ebook reader. I have a Kindle DX but it has trouble with many of the tabletop RPG PDFs I throw at it and the 4GB is a tad small to hold my 14GB collection. The built-in PDF reader is worthless, slow to open files the Kindle DX had no trouble with and wouldn't even turn pages. I jail broke it, install a mostly vanilla image of Froyo and installed Adobe Acrobat and from there it shined. Page turning and navigation was a breeze and it complimented (read not-replaced) the Kindle DX quite well.It's a tad small for anything more in-depth than book reading and Angry Birds. Even casual web browsing can be a pain and it's place as a bastard hybrid of a phone OS on a 7"" tablet form factor means it has the worst of both worlds. Maybe once (if?) Android tablets take off we'll see mobile pages more suited to them. The huge up side is that it fits perfectly in a large coat pocket and looks sleek enough to make you look cool removing it from the pocket of an aviator jacket.In the end it spends most of its time sitting on a shelf collecting dust. It'll probably end up a gift for someone who doesn't mind lower-end electronics. These days while the Kindle Fire looks good I'm waiting on the market to mature and Windows 8 tablets to ship before I go looking again.","11 13, 2011",AKLVJGUVQ0ZP1,panton41,It's passable once jail broken,1321142400.0
438,1400532655,"[7, 7]",5.0,"A syndicated consumer advocate has a saying: ""I am willing to pay less for less.""  So am I.  I actually bought the Nook Color (NC) more for its tablet features than its e-book features.  I considered several tablets for at least double the price, but when the new Android OS was released for the NC, I decided to try it out.  I personally have not been disappointed.Here is what it doesn't have: camera, USB accessory support, fast processor, robust app forum, 3G model, and long battery life.  But as I said I am willing to pay less for less.  I primarily wanted it for basic web browsing (with Flash capability), movie playback, e-mail capability, and e-book capability.My experience has been great so far - I have had my NC for about six weeks.  I personally have had no problem with the web browser and it has met all of my needs.  Movie viewing has been fine and I have had no problems viewing them.  I use Handbrake to convert movies/videos to a format for the NC, and it works great.  I have several e-mail accounts I use for personal and business purposes, and the POP3 support the NC offers is perfect.  I am no longer tied to my PC, laptop, or confined to the small screen of a mobile phone.  As for the e-book reader, it's great as should be expected (My 8 year old daughter actually uses it for reading more than me.  I download books from the library for her, and she loves it.)  The notation, highlighting, and other reading tools are fine and it also has several options to customize the font and background color as well as the font size.Other reviewers have commented about crashes, but I have not had a single crash yet.  And I also don't think the stock Android OS is bad at all, but with this being my first experience with a tablet and Android OS, my expectations may have been lower than normal.  I am also hoping that the app market will improve over time.  I know I could root the OS, but for the time being I will just stick with what it came with.  To sum it up, I got what I paid for and am very happy (so far) with my NC","05 28, 2011",A160H0YEDV1DA0,PC,Nook Color,1306540800.0
439,1400532655,"[3, 3]",5.0,"Purchased the Nook Color over a month ago.  I have been reading alot more since I got it , as it's so convenient to take everywhere.  I have not had any issues reading in the car on sunny days.  I also like the ability to read at night in my bed without any lights on, thus minimizing chances of waking up the wife.  The screen is very sharp and easy to read.  Magazines look awesome on the Nook Color and it's so much more convenient than having a stack of magazines clutter up the house.  I do not think it would be easy to read on the beach under direct sunlight, but it will be fine if you are under an umbrella (which is what I do when at the beach, as I'm cancer phobic). Wi-fi connection is automatic , seamless.  The web browser is better than I expected - and I use it often to read online newspapers and check email (way better than the Kindle's browser).There is to be a sofware upgrade in the next month or so which will enhance the NC even more.  Or you can root it yourself to turn it into a full blown tablet (at half the price of the Galaxy tablet!)The only drawback is the weight of the NC - it weights about the same as a hard cover book (though easier to hold than a hard cover book).","01 20, 2011",A1BZ18U2EF4FAI,PD,Awesome reader - tablet,1295481600.0
440,1400532655,"[0, 2]",3.0,The on-off button is located so that you will frequently turn off tbe machine by accident. The power button should be recessed. Same for volumn control.,"04 21, 2012",A25UWYG38UIHF6,"Pedro Uno ""Pedro Uno""",ergonomics,1334966400.0
441,1400532655,"[0, 2]",5.0,exactly what my daughter wanted.  she is more than tickled with this reader.  She will use it for hours and hours,"03 1, 2013",A1LZ2BZTMFPGI2,Peggy Sue Wilburn,nook,1362096000.0
442,1400532655,"[3, 8]",2.0,"i bought this with my brother for Father's Day. I tried to help him use the product thinking that i'm a reasonably educated person.The main problem that we had was trying to read Google ebooks in pdf format. I tried different methods. Downloading directly didn't work. And they will tell you this too as their help desk told me. And downloading it from a pc and transferring it.Even after going to a Nook kiosk, they were unable to figure it out and they even called tech support. Apparently they just don't work.This whole process of trying to get pdf ebooks to work was soo frustrating.Other huge negatives. Not very responsive and poor battery life for something that doesn't doo much for you and isn't that simple to use.My advice. Get a refurbished iPad. You'll be happier for the small price premium over a nook color. It does so much more and is worth the price.","06 22, 2011",ALA8RE2HDEVIK,Petes,Why would you get this.,1308700800.0
443,1400532655,"[12, 12]",5.0,"I was instantly the hero for my wife this Christmas, when I surprised her with a nook color under the tree. The device has great aesthetics, with a 7 inch IPS LCD display that is one of the most pleasing I've ever laid my eyes on, a thin and sleek profile, wonderful packaging, and nice support from Barnes and Noble, but that as Paul Harvey would say is only the beginning, this review is about the rest of the story.  At first glance this appears like just another eReader, but with a color screen for magazines and children's books swapped in for the normal eInk, but there is something different lurking beneath.  This device runs android 2.1 under the hood, heavily modified as it may be out of the box, and with that choice of operating system comes a potential access a world of hackery that is well beyond the reach of any other eReader.  In order to access this world you need to be willing to educate yourself a bit and root this device.  The process is actually quite simple (go to XDA-Developers forums or nookdevs.com Nook Color portal to read about it), and despite the dire warning disclaimers quite foolproof, and fully reversible (just in case you need warranty service).Once rooted, the device gains access to android market, where you can get thousands of apps, games, and tools for free (legally), or for a small purchase price.  Compared to the currently empty nook app store, the android market is bursting with exciting activity.  A rooted nook color gets access to the kindle app, so you can basically read all your amazon purchases on this device too.  Sony Reader app is coming soon from what I've heard, so you are probably going to get support for that store too.  Tied to the Kobo ecosystem, to borrow a phrase, there is an app for that.  Emulators for old game consoles are working nicely.  Playing Angry Birds on a 7 inch tablet is so much more fun than on a tiny 4 inch phone.  Stock browser lacks pinch to zoom, download Dolphin HD, and there you go.  Can't put app shortcuts and widgets on the home screen, home switcher and one of the freeware launchers (ADW is pretty nice) got your back.  A rooted nook color becomes something of a worthy competitor to the much more expensive iPad and Galaxy Tab.  Unlike real android phones and tablets, this does lack the physical menu, back, and search buttons, but a software softkey is installed upon rooting, so there are functional on-screen virtual equivalents to do the job.Don't get me wrong, there are some things that won't work, as nook color lacks a 3G radio, camera, or GPS.  The ROM is also a heavily modified version, so some abilities have been stripped out, and won't be available until a true custom ROM is available.  But more apps a likely to work than not due to a capable processor, ample storage packed underneath, and most importantly a talented and dedicated hacking community willing to experiment with their device and then educate others.  This is still early in the development life cycle of the nook color, so their are some rough edges to the process, some things will require resorting to the command line to fix.  Considering what you get for the money, this is probably the best handheld portable device on the market today.  An instant game changer without a doubt.","12 27, 2010",AFM9LKET50RZ4,Rajendra S. Gondhalekar,A great device if you are willing to hack a bit,1293408000.0
