,asin,helpful,overall,reviewText,reviewTime,reviewerID,reviewerName,summary,unixReviewTime
306,1400501776,"[2, 3]",3.0,"(update) I find my review written about Nook HD included here for an entirely different model tablet. Amazon or B*N this is unethical!D.F.---------------Nook HD overviewGreat screen, no cameras, weak speakers, crappy battery life, compromised android OS, but an inexpensive way to browse web and run the world of android apps on a fast, beautiful display. Plus it has a microSD slot to hold lots of videos for offline viewing. And of course, its original purpose, to provide a slick interface for purchase and reading of magazines and books.PlusesWide range of browers available. I have 9 on my machine. All browsers for tablets have reduced functionality so some browsers are better than others for specific tasks. For example, Firefox will play video in HD and does not redirect to mobile sites. Tint and Zirco have a homepage that will access a local html file. With several browsers installed it's easier to get around site restrictions. Firefox has an addon that auto-deletes cookies. Chrome allows spoken search inputs.The world of 700,000 android apps can now be accessed on Nook HD including big and nice apps: Google earth, Skype, YouTube in HD, Adobe Reader, WiFi Analyzer, WiFi Fixer (essential Wifi tool), Google maps, best solitaire ever (by MobilityWare), and free 'run' games. Custom moving backgrounds on Nook HD home screens are fun.AnnoyancesIn two months I have not figured out how to add a browser link to Nook HD home page. Some browsers have the option to add a link to the homepage, but it never works! (It must be that the Nook HD OS does not allow this)Poor battery life, by test I get only 4 hours.Adroid apps normally just suspend, so it tends to take too many presses and taps to cleanly start an application.Audio does not shut off when you exit most radio and music apps. With no OS support for shutting apps down I often have to resort to a reset to silence them.Built-in email has a short time window so you only see few or no messages. Apps like FastHotMail can provide workaround.Screen capture is clumsy (pushing Home and Vol- requires a lot of force and nearly simultaneous pushes).Nook HD not really useful for music, sans headphones, because sound volume on speakers is relatively low.Setting up icons on home screens is kind of a pain. Half of the main screen is taken up by a carousel that cannot be removed. The Nook recommended way of moving an icon to an adjacent screen is to hold icon overlapping the edge, but I find this hit or miss, it only seems reliable after a reset.File directories can be accessed via USB, but have some annoyances: Many file managers have a hard time finding personal files lost in a maze of OS directories. Nook HD allows deletion of its standard user directories (like 'kids B&N; files') only to later write them back again.Tablet does not reliably remember some settings. Occasionally I find the screen will be dim or the notification is too loud and when I look the setting has changed.No way (that I have found) to add personal data for quick entry.(update)Bluetooth keyboard problem solvedI have an inexpensive bluetooth keyboard that works fine with another tablet (Blackberry Playbook), but I could not get it to work with Nook HD. It would pair fine, but nothing happened when keys are hit. I see others complaining of this too. Finally I solved the problem with an app called BlueInput (available on Play Store). It now does the pairing, not Nook OS, and you select the bluetooth keyboard using 'Switch Keyboard' icon.(update)Fix for adding web link icons to the home page. Some browsers have the option to add a bookmark to Home, but this never seemed to work in Nook HD. I think I now understand the source of the problem. The default Nook HD launcher (with carousel) ignores them. The work around is to install the Nova launcher, and it will show them on the home screens.","07 26, 2013",AOMQZAS76F3V3,Donald E. Fulton,"Cheap way to browse web and run android apps on a fast, beautiful display",1374796800.0
307,1400501776,"[40, 40]",5.0,"If you buy this from a B&N; store, and are a member of B&N;, you can get this for $174, which is cheaper than the 8 gig Fire. If you already are loaded with Kindle books, B&N; foolishly doesn't have a Kindle app, but you can, on Amazon or n2a.com buy an n2a card which allows you to boot your Nook up as a full Android complete with access to the Android Market (or whatever Google is calling it now), and get the Kindle app to accress all your Kindle books.  Since I love the design of the eReader  on the Nook, I use my n2a card only when I want a Kindle book.  I find the B&N; Nook books are usually the same price as Kindle.  Occasionally, Kindle doesn't have a book I want but Nook does.  Also, Nook may not have a book Kindle has.  Also, Nook books have the page perfect series, as well as Enhanced Editions with embedded videos and audio clips, neither of which Kindle has.The Nook has a tab for ""My Stuff"" so you can drag things from your PC to the Nook.  If you want more space for your stuff, you can get any sized san disk for the Nook.  I have a 32 gb one because I transferred about 4,000 pictures to my Nook and am using an app to edit the pictures and then make slide shows of them. Then I'll drag the shows back onto my computer and burn them to disc. Did I mention the Nook is a joy to use? I actually got thre 16gig Tablet but the 8 gig is as fast and has the 11 1/2 hour battery as well as allows the same cards to be added.","04 23, 2012",A2FHM5FB0BXKGA,"Dr. Elaine O. Chaika ""book, movie, tech lover""",Biggest Deal Around,1335139200.0
308,1400501776,"[2, 2]",5.0,"Three of my children are sharing it now. I do not see the need to buy another tablet because I do not allow them to play with it too much. My oldest child uses it for email, news, weather, and more while in school. She prefer it to a computer even she has to share with her sister and brother. it starts in seconds, it weights less and is firm enough to be put in her school bag (with cover of cause).It has the convenient access to the free Istory books, free classical books, and some games that my children occasionally play with. My older children would record some of the books for my smaller children to listen. It save me a lot of time to read to them. The dictionary is at their fingers.Not a bad gadget for education.","10 8, 2012",A1G9SOE51HET8E,Frank,Good for education,1349654400.0
309,1400501776,"[0, 0]",5.0,"Excellent display quality. It runs fast, and does have more memory than its predecesor. The size is appropriate for my day to day needs.","07 21, 2013",A3KOA0YU5LB92W,I. Hdez.,Very good.,1374364800.0
310,1400501776,"[0, 3]",2.0,The price of this tablet I do love.Thats about it.First of all the design of the the tablet feels very cheap.Almost the whole shell of the nook is plastic.Since also the home nook button neing plastic sometimes it gets stuck and makes it hard to push.The format of the homepage I do not like.If you want new wallpaper you have to download a picture file file onto your nook same with music and video.You do get the apps hulu netflix and pandora but thats very limited.Whats also very limited is the app store.What a joke.The apps are all very boring and overpriced.The book are usually never free.The only Up to this tablet it you can watch flash video which is basically the only upside to this piece of junk.Either save up your money for an ipad or or kindle fire.I will be returing my nook!!!!,"08 28, 2012",A15KCEKCUCYF0O,imboredtotears,A Tablet With Very Little To Show,1346112000.0
311,1400501776,"[0, 0]",4.0,"I bought my wife a Nook for Christmas two years ago, and she has used the heck outof it, so I have always wanted one for myself. When I saw the price break on this oneI had to act! It meets all my expectations.","11 13, 2013",A3JOGUHYHZV8LD,"J. Crouse ""Entrepreneur""",Happy Nook,1384300800.0
312,1400501776,"[1, 2]",4.0,"I have mixed feelings about the tablet.  I really like and don't like features of this tablet.  I'm keeping my fingers crossed that later versions improve the potential of the Nook.LIKE:1.  layout and function of touch screen is intuitive - the Kindle Fire requires instruction2.  built-in wi-fi3.  the hardware is solid4.  the price is competitive5.  Netflix and Hulu are available and app market is expandingDON'T LIKE:1.  no bluetooth or GPS2.  do not have access to the full Android Market3.  no video rental option - apple and Amazon tablet have better market places4.  only 8 GB memory and although it can be expanded with microSD, less convenient than other tablets5.  the e-reader is not as good as a Kindle but then what is?  at least the iPad allows for the Kindle appFor now, I'm sticking with my Kindle Fire over this Nook but I'm keeping my options open for future purchases.","06 27, 2012",A18S2VGUH9SCV5,Margaux Paschke,MIXED FEELINGS,1340755200.0
313,1400501776,"[0, 0]",3.0,"I bought my 8gb B&N; Nook new for $149.99.  At $200 list price I would say it's a rip-off and I'm still not thrilled that I spent $150 on it.Pros:  Expandable storage via micro-sd.Reliably plays mp4 video and e-book files.Netflix and Hulu Plus apps are reliable and have good interfaces.Reliable (but not particularly long-distance) wireless antennae.Bright screen with good color, contrast, and resolution.Responsive touch screen.Good battery life.Cons:  Web browser is slow, unreliable, and crashes often.Limited, closed operating system with expensive applications.Headphone jack is low-rent - too quiet and scratchy with some of my speakers.Horizontal / Vertical screen calibration lacks enough customization options.Made from cheap plastic - micro-sd cover slot fell off.No way to rent movies or TV episodes from Nook store.Hard-to-use music player that has problems playing some mp3s that other devices can play just fine.It's good as a potable media player but is definitely nerfed as a touch-screen portable computer. If other tablets were priced in the same $150 range I would have rather got something a lot more customizable with access to free apps.","08 25, 2012",A3LZQZMCIZDXK3,Mayor Bloomburger,Meh - Some buyer's remorse,1345852800.0
314,1400501776,"[0, 0]",5.0,"Purchased as a Christmas Gift for my son.  He loves it.  Best gift (according to him).  We loaded a few of his faborite games and downloaded some books.  He loves to read, and hasn't put this down since unwrapping it.Hightly recommend.","01 7, 2013",ACMKJIW7FKAR5,Mike Bowers,Big Hit,1357516800.0
315,1400501776,"[0, 0]",5.0,"I assumed that I had the 16gb model but the box was misbranded and my bad for not paying attention,too late to take back to the store but it is still a very good tablet and the memory can still be expanded by sd card. I have since rootedmy tablet and it is great! I do have the 16gb one after all.","07 10, 2013",A3DM8NDY4EIUP1,mj,It is a very good tablet.,1373414400.0
316,1400501776,"[70, 73]",3.0,"Pros:The hardware is nice, I have the 8GB - Its fast, responsive and the screen is beautiful. Great for reading books and netflix. Battery life - Read 'Catching Fire' and 'Mockingjay' on a single charge. Email and web are decent too - nothing special.Cons:The B&N; Nook OS and the B&N; App selection are both terrible. The Nook OS is counter-intuitive and not user friendly, there is no BACK button!? Take a toll of how often you use the BACK button on your phone or android device and you'll realize how annoying the lack of this simple common-place feature is. You can hit the 'N' and go back to home any time - though often I wanted to go Back, not start over. The selection of apps in the app store are laughable. I literally could not find a single app I wanted, even searching apps that they advertise like Comics for nook (not installed? not available?). I found a few apps for $4.99+ that i have downloaded for free on Itunes and Google play (android market).Recommendation:BUY THIS -N2A (TM) - 32GB Nook to Android bootable microSD Card for the Nook ColorTakes the Good hardware of the Nook Tablet and replaces the useless OS with trusted Full Android. Read the reviews, they are all true! Before i bought this card, the nook was basically useless and frustrating - now I have an android tablet and since it is NOT rooted, still have warranty too, though I recommend squaretrade. Check my N2A review for more info.Update: I have had this tablet for over 6 months now and love it. I have had no issues and all my friends and family want one. Note: I use this exclusively with the N2A card in Android mode. N2A recently emailed me with the update from Gingerbread to Jellybean and its working great and their customer service is excellent. I cannot recommend this company/product enough.","04 17, 2012",A1MZVETF38AMZ6,"NowImMad ""Jake""",Good Hardware - terrible OS and App availability,1334620800.0
317,1400501776,"[0, 0]",5.0,"It is ok for adults. Fine for older adults who are just looking to use it to read but the place where this thing shines the brightest, it is bomb proof. I gave one to my toddler boys last year and it still works 100%. It has been spilled on, dropped, stomped on, drooled on, left in the sun and even got closed in the auto door shut in our crappy minivan and it is almost perfect. A scratch here or there but truely you could never tell what torment this device has been through.I wish I could get an apple device this durable. In the same time that I have owned this tablet my family, (self and husband included) has killed no less that 3 smart phones, an ipad, one samsung device and a dvd player.The device has also survived multiple refreshes and side loading software experiments with out even flinching.I will say that the b&n; app store is pretty pitiful but like I said It's easy as pie to sideload the google play store and have access to pretty much anything you want.","04 9, 2014",A3OYMK6UMM871F,oldcandyeater,This is by far the best kids tablet on the market,1397001600.0
318,1400501776,"[0, 0]",5.0,The Nook 7&#34; 8GB Wifi tablet was a Christmas gift for my husband. He had a  plain Nook for reading. This upgrade seemed logical because he already had a Nook account. The new Nook takes cards he already had. He loves it.,"01 1, 2013",A3ADJ00F29DU5I,Sandra Bidewell,A gift for my husband,1356998400.0
319,1400501776,"[3, 3]",5.0,"This is very amazing. It has a ton of features and has a great looking VividView touchscreen. Here are some of the features and things it can do.-Very strong, I dropped mine from 5 feet to wood floor and it was fine.-Very fast but slow at navigating the home screen.-Has a physical home button which comes in handy in case you want to quit something.-Has expandable memory so you can have tons of content on this.-You can personalize the home screen with your own wallpaper.- Loads pages fast and plays videos well.-Has a VividView touchscreen which does what it says and makes everything vivid.-The os is tweaked which is nice if you don't care about android.-The microphone works great .-It has physical volume buttons.Over all this is a very good tablet if you just need to do basics like read,email,play games, play videos and search the web. It can also do more than basics.","07 7, 2012",A1H8I2PH00UQ2K,"Valerie Trahanovsky ""THE TRUTH""",This is amazing!,1341619200.0
320,1400532620,"[2, 3]",1.0,"Highly disappointed. I purchased the new B/W touch version of the Nook and had intended to use it for lecturing in class when I need to do it from the book. I didn't know that you couldn't download the etextbooks to my Nook from the NookStudy part of Barnes and Nobles. Why would you call this NookStudy if you can't download the textbooks to a Nook reader?Seriously!I could live with the some of the shortfalls for this device (slow touch response, flickering on the screen when changing pages, keyboard mistypes characters, etc), but not being able to download a textbook from something that says ""Nook""Study? Smacks of misrepresentation, somebody should sue. On the NookStudy web page, it says that a ""Nook"" is not required, it should say, ""Not intended for Nook Devices"". Also, it will not load onto any other hand-held device that has the Nook app, only on a PC or a Mac. They should rename it to ""DeskTop Study"", using the Nook label when you can't use it on a Nook device is false advertising (anybody want to sue?).Anyway, I'm returning this and buying a Kindle (at least Amazon will tell you what devices you can install their etextbooks, i.e. almost all their Kindles, Mac, PC and oh, an iPad!).If your planning on buying this for your college bound student, get them a Kindle instead.","07 18, 2011",AES2AZFVTXKBZ,"Amazon Customer ""Charge It""",Not for Students and Professors,1310947200.0
321,1400532620,"[0, 0]",3.0,This nook has a very nice format and is very easy to operate and view.  The only draw back is the Battery life is terrible.  I am charging this unit twice a day.  My former Simple Touch only needed charging once a month &#34;with the wifi ON&#34; all the time.  I would NOT recommend this product.,"06 21, 2014",A1IK1ZTDHJS6WW,Amazon Customer,Could be better,1403308800.0
322,1400532620,"[3, 3]",4.0,"If anyone have used previous version of nook you will immediately see the improvements on new version of nook. One of the most important feature I found on the new nook was better page turn response. The screen refresh when moving from page to page is much quicker, nearly matching the refresh rates of the latest Kindle. The Nook also added a laundry list of interface and usability improvements, such as the ability to organize your book collection by category which is called ""shelves"".I liked 600 X 800 display screen. It comes with 16 shades of gray and is easy to your eyes. I can read all day without hurting my eyes. My personal opinion, i would love this device more if I could read it at night without lights.ProsLibrary with thousands of books, magazine that comes free, built-in free wireless data network, plus Wi-Fi connectivity (no PC needed); separate capacitive color touch-screen pad for navigation, and a virtual keyboard for notes and annotations; 2GB of internal memory (capable of storing 1,500 electronic books) as well as a microSD expansion slot for additional memory; font style and size are adjustable; displays image files and plays MP3 music files; compatible with Windows and Mac machines; battery is removable and user-replaceable; allows free browsing of full-text books while within Barnes & Noble stores; you can lend certain e-books for up to 14 days free of charge; EPUB format compatibility lets you read free Google Books and loaner e-books from your local library; page turn speeds are faster with firmware upgrade.The bad: No protective carrying case included; color LCD ( for color nook)  has an impact on battery life; for black & white battery is really good,in-store reading and loaning capabilities come with notable limits and caveats; no support for Word or text files; no ability to download books when outside the U.S., even when on Wi-Fi.Does it beat Kindle?According to design my answer is no.  The third-generation Amazon Kindle is lighter, thinner, and simply feels a little better to hold in your hand. It also offers double the battery life, more internal memory (4GB versus 2GB). But the new upgrades has given some new features to nook that are not available in kindle. Nook should definitely remain under consideration when you're shopping for e-ink e-book readers. The decision may come down to a personal preference, such as how you feel about the color navigation screen versus the hard keyboard found on the Kindle.If my review did not answer any questions, leave a comment below and I will try my best to answer your question.","12 26, 2010",AQGUDK0MSQ95L,"anildgl ""A. Dgl""",Worthy wifi e-reader for everday reader.,1293321600.0
323,1400532620,"[1, 2]",5.0,"This tablet from barnes and noble is an afforadable alternative to the ipad. Serves more than one purpose ...while its primary function is reading. The original nook is a whole family experience. Its size and durability give the nook, nook color, and nook tablet are built with quality materials so that they have longevity. This is a gift for the teachers assistant at my sons school. She wanted something to read her books on, and since i have the nook color i figured this would be a good start for her.Barnes and Noble NOOK eBook Reader (WiFi only) [ Black & White]","05 17, 2012",A2V24K8UWPPDSB,ashley miles,intro to a classic...,1337212800.0
324,1400532620,"[5, 6]",1.0,I bought this unit as a gift for the grandchildren to read books. My plan was test it out and buy 3 if it worked. I planned to buy gift cards for the unit so the kids could buy books. Barnes and Noble requires a credit card to activate this unit! That is a show stopper as it is not desirable for young children to have a unit with credit card information linked to it. They could lose the unit etc. I loaded my credit card information to test the unit. After deciding to return the unit I talked to customer service about deleting my account information. The answer from 3 people was you can not delete your account information. I can not recommend this company.,"12 9, 2011",A1HZWHI3JLGZ5N,atrox13,Barnes and Noble NOOK eBook Reader,1323388800.0
325,1400532620,"[11, 13]",4.0,"I bought the Nook last week, its always a joyous experience to buy something from a store, activation was easy on the device, took some time to create new account on Barnes and noble site, but I was ready to go in 15 minutes.I purchased one book and started reading immediately, after 4 days, suddenly the e-ink screen went darker. The device comes with one year warranty, I took it to the store and they replaced it in 5 minutes, again, the store experience was great.Pros:1- The device look and feel is good, design is sleek and smooth.2- Touch screen is a good idea, I have tendinitis so I prefer to use touch screen over keyboard.3- The page turn keys are in good place, very comfortable to read and hold at the same time.4- Found many books on the library search, it has detailed editorial and user reviews, with ratings, just like Amazon site.5- The format is not proprietary, this was a huge sale point for me, there are other devices that can read the same format.6- Battery is replaceable and memory SD slot is available.Cons:1- The touch screen is sluggish, you need to use it slower than using other touch devices, this is either buggy hardware or CPU is too slow.2- First device I got was defective, not a good sign, hopefully the second one is better.3- Browsing the web is ok, but using the small touch screen to navigate through HTML is not an easy task, especially since it is sluggish.4- Not all books are available in the on-line library, I found a psychology book in the store that did not exist for download.5- You need to use screw driver to open the back cover and replace battery or insert SD card.6- Little bit heavy, certainly heavier than a medium size hard cover book.","09 18, 2010",A1MYO26LV8X7JI,Bill,So far so good..,1284768000.0
