,asin,helpful,overall,reviewText,reviewTime,reviewerID,reviewerName,summary,unixReviewTime
578,1400599997,"[0, 0]",3.0,"I bought the original nook in Aug. 2010. Initially, I liked it, but I quickly learned that the battery life wasn't nearly the quoted time (it lasts about 2 days for me, 3 max with wireless off and the most power-saving settings). The e-ink/lcd screen mix was nice for navigation, although I understand that the newer touch models will be more battery-efficient. Despite this drawback, it was so much more convenient than paperbacks. As much as I love the feel of books, in a NYC apartment, there just isn't all that much room for them!That nook lived for about 9 months until a part of the screen died - just black pixels. I called customer service and after a long painful process, got it replaced. The unit I got was clearly a refurbished unit, which wouldn't have bothered me, had it been identical to the one I sent it. My original nook had a two-part screen, this new nook had a one-part screen and its' buttons squeaked when pressed. Little did I know at the time that this was the sign of a very important defect! As it happened, this 'squeaking', which made the buttons difficult to press, also caused the page-turn buttons to crack just one month past warranty. Needless to say, I wasn't delighted. Apparently, the page-turn buttons cracking is a very common defect. So if you buy a nook, remember this: if the button squeaks and is hard to press, it will break. Return it while you can. Not all the nooks are like this (my old one wasn't), so I recommend checking it out.Overall - 3/5 - it's a solid reading device but doesn't really compare to the new-generation nook simple touch/kindle touch devices or even the Kindle 3 keyboard (which I now also own).","11 27, 2011",A1BDZE0TP6L492,Juniper,Nice device but battery and Customer Service problems,1322352000.0
579,1400599997,"[3, 3]",3.0,"I bought a Nook today. The one and only reason I chose Nook (instead of just sticking with and upgrading my beloved old Kindle 1) is its ability to download books from the public library. Tomorrow I am taking the Nook back to Best Buy for a refund, not an exchange. The Nook is attractive and nicely packaged. I completely expected it to just work, like my Kindle did (and still does) and all of my Apple products do. But, like so many other reviewers here, my Nook never even got up and running before it croaked. First, it would not complete the registration process. I have an active account on B&N; and strong WiFi in my home, plus this Nook also has 3G so there were not any connection problems. Then, when I decided to just register later and moved on to explore how the Nook worked, it froze. Could not reboot or turn it off by holding down power key as suggested in the troubleshooting help/support on the B&N; website. It did not work. I do not want to mess with taking the back off, using little screwdrivers or whatever to take out (the fully charged) battery, etc. We should not have to do that on a brand new 200.00 product! So, am taking it back and won't buy another until they improve the quality of the thing. I never had one bit of trouble with my trusty Kindle, and would not even be looking at another brand of reader except for Kindle's inability to download library books.  I'm giving the Nook two stars instead of one because, if it actually worked, it looks like it would be a nice ereader and it has a more open format than Kindle does.Update: 1/28/11Went to return the Nook for a refund today and at the last minute decided to give it another go, so did exchange instead. Tonight charged and powered up the replacement Nook, so far so good. It works perfectly. Registration was smooth and fast, wifi connected easily with my signal, downloaded a book quickly, and navigation is a breeze.  No problems encountered yet except that it is not downloading an available firmware update, and there's probably some explanation for that so not a big deal.  So, I might just end up keeping this baby as a companion to my Kindle. Love having the Nook with its open format for library and other downloads. Will see how it holds up over the next several weeks and then update my rating accordingly.Update: 2/3/11Returned the Nook to Best Buy today and bought a Kindle 3 through Amazon. After exchanging the first defective Nook then using its replacement for several days I found that the device worked pretty much as it was supposed to. There are a couple of minor things about it that I was not crazy about and probably would have gotten used to, but there is one problem (design flaw?) that for me is definitely a deal killer. One of the minor annoyances is that there is a lot of screen flash during any menu change. Another is that the color, lighted touch screen control at the bottom of the device is distracting when it lights up at any touch during reading. And after a while I was not that crazy about the menu navigation either, seemed like too many steps and screen flashes, but probably could have gotten used to that too. I would not have rejected the Nook just over those little quirks. The big reason that the Nook was no way going to work out for me is, again, that touch screen display at the bottom of the device. It is, like an iPad, highly reflective. So what that means is that when the screen is off, which it is most all of the time during reading, you can watch yourself read! The black screen reflects anything in front of it, almost like a dark mirror. That was a no go for me, no I did not like it at all. Aside from these annoyances, the Nook did well at everything it was designed to do. So will upgrade the rating to reflect (haha) that. I have to say that I am much happier with the Kindle, but Amazon really needs to get with the program and let Kindle use the epub format. They will eventually lose me and a lot of other prospective customers over the epub problem, it is that big of a deal.Yet another update! 5/31/11Caved in and purchased another Nook last week. I still love my Kindle and prefer it over Nook, but just could not wait another minute for Amazon to open Kindle to ePub for downloading public library books. So, last week when B&N; had Nooks for sale cheap on their eBay website (99.00, free ship, 3g/wifi, non-color, refurb w/ full warranty) I jumped on it. This refurb Nook worked much better out of the box than my initial brand new device purchased then returned back in Jan/Feb. I am using the Nook just for library books, and it does what it's supposed to do. Navigation works well, but seems like it requires more step than Kindle. Still do not like the reflective color screen below the reading area. There is one thing that I do like better on Nook, the screen background is a paler gray than Kindle making for easier reading in low light. I will keep this Nook until Amazon does ePub, then stick with Kindle.","01 27, 2011",A2IAD8XA81CQWQ,kare777,Kindle lover jumps ship for a few hours,1296086400.0
580,1400599997,"[16, 17]",4.0,"There are a multitude of reviews that compare and contrast the Nook and Kindle, so I'm not going to go into a full-blown comparison and review. I'm going to focus on my experience owning both, most specifically battery life and availability of books.My husband uses the kindle and I use the Nook. The reason I went with the Nook is because initially I was very ""anti"" non-paper book. He wanted a kindle and I sneered at the idea. I was being a book snob and didn't like the idea of books in electronic format, so I snubbed my nose at it.However, after we took a vacation and he had his kindle loaded with books, and I had 8-10 big paper books, I began to reconsider my position.  Upon return from our vacation I elected to get a Nook. I did so because I liked the idea of the touch screen at the bottom rather than the keyboard, which I thought made the kindle look klunky. I thought overall that the Nook was more aesthetically pleasing. So - I ordered the nook.There are two major things that the kindle has on the Nook, and that is far superior battery life, and significantly more books available for download - especially so if you read non-fiction.The battery life on my Nook is awful. So much so that I ordered a new battery thinking perhaps I had a dud. Nope - it's performance is just the same. If I am actively reading a book I have to recharge  every 3 days. If I don't read it for 10-14 days it will drain on it's own. Comparing this to my husband's kindle, he can go an entire 2 week trip reading books daily without having to recharge his kindle! It takes a couple months to drain with no usage. The kindle's battery life is mega-much more than my Nook. I have serious battery life envy. For that alone I've begun to covet his kindle.The second bummer is that most of the available books for Nook are fiction. There are some of the more popular non-fiction type books available. Usually whatever is most trendy at the time, but for the most part any professional type texts, or anything not on a best seller list that is non-fiction can't be found for the Nook platform. However, when I go to Amazon, 8 of 10 times, I'll find it available for download on the kindle.BUT! One thing about this is that for me, I tend to mark up and highlight my non-fiction books a lot because I'm using them for reference sources. It is very difficult to quickly retrieve highlighted text from the electronic source compared to my real, paper books. So I've actually come to realize that I'd likely be purchasing my non-fiction as real paper books anyways, so that I can have them for ready reference and mark them up with my highlights and little flags (yes - I'm a geek who uses the little flag tabs to mark pages in my books!) So, I'm now fine with the fact that I can't readily download non-fiction to my Nook and instead I continue to buy them as regular, paper books. As I said above, I'd likely buy my non-fiction as real books anyways since I use them as references.I now download all my fiction books to the Nook. So it's become my source for pleasure reading, which is great, since that is the kind of stuff I take with me when I travel or about town anyways, and can just stuff the Nook in my purse.However, I VERY MUCH ENVY THE BATTERY LIFE OF THE KINDLE! If I could stuff a kindle battery into my Nook I'd be a super happy girl.If I had it to do over I'd likely buy a kindle for myself despite it's less aesthetically pleasing appearance. The battery life and availability of books is far superior to the Nook.","09 26, 2010",A2YCEKVUN1W5F1,"K. Salinger, MSN, FNP, RN AHN-BC",Extra info to consider between Nook & Kindle (I own both),1285459200.0
581,1400599997,"[0, 1]",5.0,"Had this for sevral months now and I love it. I love the touch screen which lets me see the covers of books in COLOR!VERY easy to set up account with B&N; using my nook. It serches for wi-fi and is very easy.Anytime I have had any problem, a simple re-boot fixes it.I love the ""free Friday"" that is offered. I have read SOOO many books since I bought it.I also think I would like the ""Lend Me"" option if any of my friends HAD a nook.","02 1, 2011",ANEUPVXP9GKJQ," Leah  ""Leah""",Great!,1296518400.0
582,1400599997,"[16, 17]",5.0,"Pros: eInk display preserves traditional reading experience and has great clarity and contrast. Reads PDF (both scanned and standard text) and EPUB book formats with no hassles or conversion required. In-store help and extra features from B&N.; Page turning speed is much improved with most recent update. Android OS allows for almost unlimited software improvements and added features. Replacement batteries can be bought and installed easily. Accepts SD cards for increased storage capacity (this really comes in handy if you want to use the device as an mp3 player or for audiobooks).Cons: eInk display requires you to operate at a bit slower pace than the touchscreen alone would allow. (Also: Not sure why the price from this supplier is abnormally high?)I've played with an iPad and it's a very fun device. But what I don't like is a glowing backlit screen, as I look at a monitor all day. When I read, I want to relax and give my eyes a break, and that's why I prefer eInk displays.The Nook's primary advantage over the Kindle is that it allows you to read EPUB and PDF books (scanned or text; either works) and buy books from various online ebook stores, including the Sony Reader store. This has already allowed me to read two titles that I wouldn't have been able to get for the Kindle. It also works very easily with Adobe Digital Editions software, a huge plus. Currently Amazon offers some titles that B&N; does not (a very temporary state of affairs, I suspect), but those are usually available from Sony.Add the book loan feature, free library books, and the ability to take it to a B&N; store for bonus features, and this unit pretty much stomps the Kindle and Sony readers.The Nook is a little slower than a phone or your other electronic devices due to the e-Ink screen, but once you get used to it, the device seems very smooth. In fact, I find that having to slow down a little actually helps me relax, and once you master turning pages with a quick brush of the thumb across the touchscreen, reading with the Nook is a very pleasant experience. I now prefer it to reading books in print, to be perfectly honest.","04 30, 2010",A13HUHXEQPX3YI,Lightning TigerFists,Easy on the Eyes,1272585600.0
583,1400599997,"[3, 3]",5.0,I have had my Nook for a week now and just love it.  I find the touchscreen easy to understand and use.  I have downloaded books from the local public library using OverDrive and Adobe Digital Edition and all have come through perfectly.  Downloading books from B & N have been quick and efficient.  I like being able to Find/Search forward and backward and to be able to look up words easily.  I have used bookmarks and highlights as well.  I also like the feature of being able to go to Last Read Page or to quickly pick a page using the Go To.  I have downloaded my own wallpaper and screen savers.  The two reasons I chose the Nook over the Kindle:  local support at Barnes and Noble and the ability to borrow ebooks from the public library.  I also easily added my own MicroSD card and added personal PDF documents to it. I love reading on it!!!,"09 18, 2010",A1263RB8HKHD76,"Mimi2JKE ""Mimi""",Love My NOOK,1284768000.0
584,1400599997,"[9, 12]",5.0,"I will continue to update this review as I discover new features of the Nook, so stay tuned folks!*****************************************************************************Updated 02/08/2010*****************************************************************************I've been using my Nook with the newest update (v 1.2) for a few days now.  This is the second update to the Nook since launch.  All I can say is THANK YOU Barnes & Noble!The LCD screen improvements alone are GREAT!  With better looking icons, more responsiveness, and a sleeker appearance -- it makes me think of that McDonald's commercial: I'm lovin' it!Several of the well documented issues have been fixed, such as losing bookmarks due to powering off the unit -- which as it turns out was the most cited problem for Nook bashers and haters alike.  Nook haters will also be disappointed that the battery life has been optimized too.All-in-all if you've been waiting for the minor 1.0 issues to be fixed prior to purchasing the Nook you will not be disappointed in this newest version.  And if you have been considering switching from the Kindle you would be well advised to do so at this point.*****************************************************************************Updated 01/31/2010*****************************************************************************This device is clearly the best option on the market today, with it's LCD touchscreen, Wi-fi, memory expansion capabilities, and so, so much more. Let's ""wade in the weeds"" and look at some of the features in detail:LCD TouchscreenSo far this is the only mainstream reader to offer a LCD screen of any kind. The Coverflow-like book cover listing is beautiful, elegant, and functional. With the newest update it is uber fast, intuitive, and responsive. Page turns are super easy with the touchscreen, all you have to do is swipe the screen with one finger when it's in standby mode and the page turns.  In addition, it's easier for me to navigate books via the LCD than textually. Seeing the cover is a really nice feature, since books are designed to pique your interest by the cover. It just seems like a good cover sells a book, and seeing that cover in crisp LCD sells me from time to time.The keyboard is nice, any time a text field comes up you will have the keyboard pop up on queue. It's fast, responsive, and best of all doesn't look like a 1970's era fax machine keypad like some of the older readers on the market.Wi-fiThe built in Wi-fi is one of the great features of this device. Modern 3G speeds are pretty fast, but as most of us know that have smartphones, Wi-fi is about 100 times faster, especially when one tries to download large things, or a lot of content. The Wi-fi on this device is no exception... it's fast and super easy to set up. The on screen instructions are sooo clear to follow. I couldn't imagine only having 3G these days, like when you are in an area that doesn't have 3G coverage, you can still use the Nook over Wi-fi.  This is truly one of the killer features of the Nook.  You can go into a B&N; store and Wi-fi to your hearts content, but then come home and do the same.  Hotels offering free Wi-fi are the Nooks biach.Memory ExpansionThe Nook has a Micro-SD card slot which accepts up to 16GB Micro-SD cards, this allows you to upgrade your memory indefinitely. Another advantage would be to organize your books. And books on the card are never going to get lost if your reader dies -- without having to re-download from the cloud.  Plus with the new B&N; desktop reader you can move your books from the Nook to a laptop/netbook on the fly, and what if the worst should happen and your eReader dies?  You still have those books on the card.AppearanceThis is a biggy for me as it is for most people... I don't tend to buy or use things that look ugly. That's why I've got an iPod instead of a Zune, why I've got a LCD TV instead of a CRT, and now why I've got a Nook instead of another reader. The appearance of this device can be described with one word, SEXY. It just looks good. Other readers currently available range from looking ""not too bad"" to looking downright ugly. This reader is the exception to that rule and employs a host of features to boot.Book formats and availabilityThis is probably the biggest of all the features, since we are talking about a book reader, the Nook boasts a whopping 1,000,000 books available for it, in readily readable format, from just two sources (B&N; and Google). The nearest competitor only offers 500,000 books in it's native format (Kindle). You can convert many books to a Kindle readable format, but it's a hassle and you have to use your computer to do that. Sort of defeats the purpose of the wireless if you have to constantly connect to the PC. And there are third party sources for books in Kindle format, probably websites you've never heard of, new sites pop up all the time since Kindle has a big install base, but the quality of books on those sites is in question compared to a reputable company like Google.eInk displayIt seems to be crisper than much of the competition out there. The ability to change the typeface and size of the fonts is wonderful. The nearest competitors screen almost seems fuzzy in comparison, which for me makes it harder to read. Page changes are fast on the Nook, while nothing can compare with the speed of changing a real books' page, it's fast enough for the average person. Speed readers may find themselves waiting for a few milliseconds though. The controls on the Nook are straightforward and intuitive.Replacable batteryThis is another biggy for most ebook people, with the Nook you can change the battery out should you A) want extended reading times without charge, or B) if the original battery dies for some reason.  Many of the other readers on the market do not allow this, which means they are bricked if the battery dies and will either have to be repaired or replaced.Battery lifeA lot has been said about the battery life of the Nook, and other eReaders.  All of the manufacturers of these devices overstate the real world battery life in real world useage situations.  I have a co-worker with one of the Amazon (Kindle Brand) eReaders and he has to charge every 3 - 4 days.  Nook lasts for me about 5 - 7 days, but it all depends on what features you use on either or any of the devices and how much you use them to determine actual, real world battery usage. Either way, all of these devices are easy to charge.  Just plug into a standard 110 - 120 outlet and PRESTO!  Or in the case of the Nook, you can also plug into your computer/laptop/netbook and VOILA!  You will be on go in no time flat.Ease of useThe Nook is easy to set up and use, The onscreen keyboard is more familiar and similar to modern devices than many of the competitors setups.SummaryThere are so many features of this device it's hard to capture them all in one review. All in all this is one great device, with it's iPod like look and feel, large number of built in features, and industry standard operating system, it's clearly the choice of discerning electronics customers.*******************************Update*******************************So, I had been told on these comments that the B&N; in store functionality was not ready to be used yet -- another lie dispelled today.  I stopped in at the B&N; in Hillsboro and it is in fact fully functional.  My Nook immediately recognized the B&N; network and connected without me even having to tell it to!  As it turns out there is exclusive content at each B&N; store, at this particular one there were multiple books that could be downloaded for FREE!!!  So, seeing one that piqued my interest I naturally downloaded it.  Wow, super fast and convenient, and FREE!","12 29, 2009",A19N3S7CBSU6O7,"OregonBay "" OregonBay - 1999 to 2014""",Nook eReader,1262044800.0
585,1400599997,"[26, 42]",5.0,"The Nook is the best e-reader yet. It replaces the keyboard on the Kindle with a color touch screen about the size of the iPhone display. This makes it easy to maneuver between  the store, your library, your current book, the daily (with messages, newsletters, and other free content), and settings. The LCD display changes from menu items to images of book covers to a keyboard as needed, and then turns off when reading.You can connect by both WiFI and free 3G to download a purchase in seconds, and connect with WiFi to get content and other offers when you walk into a B&N; store. I'm using the latest 1.1.1 SW release that fixes most of the issues noted in early reviews. Updates are done automatically over the air.The nook feels great in the hand with a slightly contoured back that adds a little thickness for the hand to grip. Controls are provided for equal usability by a left or right-hander person. The back is removable and replaceable with different colors. They are all rubber coated to make it less likely to drop. Unlike the Kindle the battery is replaceable and the memory is expandable. The e-ink display is the same type, but appears to be slightly crisper than the Kindle 2. The nook supports  EPUB (Non or Adobe DRM), PDB (Non DRM), PDF, Graphics: JPG, GIF, PNG, BMP, Audio: MP3, PDB. The online B&N; bookstore has about a million books compared to the Kindle store with half that, the major difference being the free public domain books provided by Google.Summary:While it costs the same as the Kindle, the nook is loaded with extra features: WiFi, color LCD, removable battery, expandable memory, more open book formats.  You can customize your nook with your own photos to create personal screen savers and lend between nook, iPhone, a PC and a Mac.","12 23, 2009",AOKC4MRKH1UON,"Phil28 ""Gadget Guy""",Nook is the best e-reader yet,1261526400.0
586,1400599997,"[1, 1]",5.0,"This is a good item. Even though it's old, it's sticks to what an reader should be. It really is good for just reading books. It has great battery and the 3G works everywhere","06 1, 2012",ATIOA4WH6UE1C,Ray,Still a good product,1338508800.0
587,1400599997,"[1, 3]",4.0,"I already own a Wi-Fi + 3G Kindle and had compared reviews between the Nook and Kindle extensively, before buying the Kindle.  But because the Nook allows you to borrow books from the local library for free, and my wife was hogging the Kindle, I decided to try a Nook, at a reduced price.  While the Kindle is clearly a superior product, (lighter, faster, easier to use and much longer battery life), I found the Nook okay at the price I paid.It was a little difficult to learn how to navigate with the touch screen and the set-up seemed ponderous, but once I got the hang of it, I've borrowed a book a week from the library.  The reduced price for the product was because someone had returned it and it presumably had been repaired.  I haven't found anything wrong with it and it looked new, unscratched and unmarked, so as a back-up to a Kindle, I'd recommend it.  I'm getting about 3-5 days of battery life in ""airplane mode"" (wi-fi and 3G turned off), and that's enough to finish a book without recharging.  I'm not rating reliability, because I've only had it for about a month.","04 30, 2011",A2TDEHV2JAV4VS,R. F. Moltzon,Refurb Nook Worth the Price,1304121600.0
